{
  "runtime_spec_preview_version": "0.1",
  "runtime_spec_id": "RSP.PREVIEW.DRYRUN.0001",
  "source_ir_id": "IR.EXAMPLE.0002",
  "active_sleeve": "SLV.BUSINESS.RUNTIME_TEMPLATE.v1",
  "requested_execution_mode": "dry_run",
  "capability_state": [
    {
      "capability_id": "CAP.PHASE.RUN.v1",
      "declared": true,
      "registry_state": "registry_known",
      "risk_level": "high",
      "blocked_by_default": true,
      "allowed_modes": ["dry_run", "assisted", "approved_execute"]
    }
  ],
  "provider_state": [
    {
      "capability_id": "CAP.PHASE.RUN.v1",
      "toolpack_id": "TP.OPENCLAW.PHASEBRIDGE.v1",
      "provider_state": "provider_available",
      "version_state": "provider_version_valid"
    }
  ],
  "binding_state": [
    {
      "binding_id": "BIND.PHASE.RUN.v1",
      "capability_id": "CAP.PHASE.RUN.v1",
      "tool_provider": "TP.OPENCLAW.PHASEBRIDGE.v1",
      "binding_state": "binding_validated",
      "allowed_modes": ["dry_run", "assisted", "approved_execute"],
      "failure_policy": "defer_to_human"
    }
  ],
  "trust_state": [
    {
      "trust_tier_id": "TRUST.BUSINESS_VERIFIED",
      "trust_state": "trust_valid",
      "tenant_binding_required": true,
      "tenant_bound": true
    }
  ],
  "approval_state": [
    {
      "capability_id": "CAP.PHASE.RUN.v1",
      "binding_id": "BIND.PHASE.RUN.v1",
      "approval_state": "approval_missing",
      "approval_required": true
    }
  ],
  "rollback_state": [
    {
      "binding_id": "BIND.PHASE.RUN.v1",
      "rollback_policy_id": "checkpoint_required",
      "rollback_state": "valid"
    }
  ],
  "executable_state": {
    "state": "dry_run_only",
    "mode_limit": "dry_run",
    "blocked_reasons": ["APPROVAL_MISSING"]
  },
  "warnings": ["Approval is required for execution but absent in this preview."],
  "errors": [],
  "blocked_reasons": [
    {
      "blocked_reason_code": "APPROVAL_MISSING",
      "category": "approval",
      "severity": "warn",
      "human_summary": "Execution approval is not present for the phase run binding.",
      "remediation_guidance": "Obtain a bounded approval token before any future approved_execute attempt.",
      "retry_possible": true,
      "requires_human_action": true
    }
  ],
  "governance_summary": {
    "declared_capabilities": ["CAP.PHASE.RUN.v1"],
    "provider_availability": "complete",
    "trust_status": "valid",
    "approval_requirements": "required",
    "rollback_validity": "valid",
    "tenant_compliance": "compliant",
    "final_preview_readiness": "dry_run_only"
  }
}
