{
  "runtime_spec_preview_version": "0.1",
  "runtime_spec_id": "RSP.PREVIEW.TRUSTBLOCK.0001",
  "source_ir_id": "IR.EXAMPLE.0003",
  "active_sleeve": "SLV.BUSINESS.RUNTIME_TEMPLATE.v1",
  "requested_execution_mode": "approved_execute",
  "capability_state": [
    {
      "capability_id": "CAP.DESKTOP.UI.CLICK.v1",
      "declared": true,
      "registry_state": "registry_known",
      "risk_level": "high",
      "blocked_by_default": true,
      "allowed_modes": ["assisted", "approved_execute"]
    }
  ],
  "provider_state": [
    {
      "capability_id": "CAP.DESKTOP.UI.CLICK.v1",
      "toolpack_id": "TP.OPENCLAW.DESKTOP_BRIDGE.v1",
      "provider_state": "provider_available",
      "version_state": "provider_version_valid"
    }
  ],
  "binding_state": [
    {
      "binding_id": "BIND.DESKTOP.UI.CLICK.v1",
      "capability_id": "CAP.DESKTOP.UI.CLICK.v1",
      "tool_provider": "TP.OPENCLAW.DESKTOP_BRIDGE.v1",
      "binding_state": "binding_validated",
      "allowed_modes": ["assisted", "approved_execute"],
      "failure_policy": "fail_closed"
    }
  ],
  "trust_state": [
    {
      "trust_tier_id": "TRUST.BLOCKED",
      "trust_state": "trust_blocked",
      "tenant_binding_required": false,
      "tenant_bound": false
    }
  ],
  "approval_state": [
    {
      "capability_id": "CAP.DESKTOP.UI.CLICK.v1",
      "binding_id": "BIND.DESKTOP.UI.CLICK.v1",
      "approval_state": "approval_required",
      "approval_required": true
    }
  ],
  "rollback_state": [
    {
      "binding_id": "BIND.DESKTOP.UI.CLICK.v1",
      "rollback_policy_id": "manual_only",
      "rollback_state": "valid"
    }
  ],
  "executable_state": {
    "state": "blocked_reason",
    "mode_limit": "blocked",
    "blocked_reasons": ["TRUST_BLOCKED"]
  },
  "warnings": [],
  "errors": ["Trust registry blocks this provider/capability chain from execution readiness."],
  "blocked_reasons": [
    {
      "blocked_reason_code": "TRUST_BLOCKED",
      "category": "trust",
      "severity": "critical",
      "human_summary": "Trust policy explicitly blocks this chain.",
      "remediation_guidance": "Review trust registry assignment before attempting any higher execution mode.",
      "retry_possible": false,
      "requires_human_action": true
    }
  ],
  "governance_summary": {
    "declared_capabilities": ["CAP.DESKTOP.UI.CLICK.v1"],
    "provider_availability": "complete",
    "trust_status": "blocked",
    "approval_requirements": "required",
    "rollback_validity": "valid",
    "tenant_compliance": "mixed",
    "final_preview_readiness": "blocked"
  }
}
