{
  "runtime_spec_preview_version": "0.1",
  "runtime_spec_id": "RSP.PREVIEW.EXPIRED.0001",
  "source_ir_id": "IR.EXAMPLE.0004",
  "active_sleeve": "SLV.BUSINESS.RUNTIME_TEMPLATE.v1",
  "requested_execution_mode": "approved_execute",
  "capability_state": [
    {
      "capability_id": "CAP.FILE.WRITE_CONTROLLED.v1",
      "declared": true,
      "registry_state": "registry_known",
      "risk_level": "high",
      "blocked_by_default": true,
      "allowed_modes": ["dry_run", "assisted", "approved_execute"]
    }
  ],
  "provider_state": [
    {
      "capability_id": "CAP.FILE.WRITE_CONTROLLED.v1",
      "toolpack_id": "TP.UMG.CORE_RUNTIME.v1",
      "provider_state": "provider_available",
      "version_state": "provider_version_valid"
    }
  ],
  "binding_state": [
    {
      "binding_id": "BIND.FILE.WRITE_CONTROLLED.v1",
      "capability_id": "CAP.FILE.WRITE_CONTROLLED.v1",
      "tool_provider": "TP.UMG.CORE_RUNTIME.v1",
      "binding_state": "binding_validated",
      "allowed_modes": ["dry_run", "assisted", "approved_execute"],
      "failure_policy": "fail_closed"
    }
  ],
  "trust_state": [
    {
      "trust_tier_id": "TRUST.BUSINESS_VERIFIED",
      "trust_state": "trust_valid",
      "tenant_binding_required": true,
      "tenant_bound": true
    }
  ],
  "approval_state": [
    {
      "capability_id": "CAP.FILE.WRITE_CONTROLLED.v1",
      "binding_id": "BIND.FILE.WRITE_CONTROLLED.v1",
      "approval_state": "approval_expired",
      "approval_required": true
    }
  ],
  "rollback_state": [
    {
      "binding_id": "BIND.FILE.WRITE_CONTROLLED.v1",
      "rollback_policy_id": "reversible_file",
      "rollback_state": "valid"
    }
  ],
  "executable_state": {
    "state": "blocked_reason",
    "mode_limit": "dry_run",
    "blocked_reasons": ["APPROVAL_EXPIRED"]
  },
  "warnings": [],
  "errors": ["Approval token exists but is expired for the requested execution mode."],
  "blocked_reasons": [
    {
      "blocked_reason_code": "APPROVAL_EXPIRED",
      "category": "approval",
      "severity": "error",
      "human_summary": "The approval token has expired.",
      "remediation_guidance": "Issue a new bounded approval token before any future approved_execute path.",
      "retry_possible": true,
      "requires_human_action": true
    }
  ],
  "governance_summary": {
    "declared_capabilities": ["CAP.FILE.WRITE_CONTROLLED.v1"],
    "provider_availability": "complete",
    "trust_status": "valid",
    "approval_requirements": "required",
    "rollback_validity": "valid",
    "tenant_compliance": "compliant",
    "final_preview_readiness": "blocked"
  }
}
